{
  "$schema": "http://json-schema.org/draft-07/schema#",
  "title": "Bing Wallpaper Index",
  "type": "array",
  "items": {
    "type": "object",
    "required": ["date", "title"],
    "properties": {
      "date": { "type": "string", "pattern": "^[0-9]{8}$" },
      "title": { "type": "string", "minLength": 1 },
      "copyright": { "type": "string" },
      "category": { "type": "string" },
      "color": { "type": "string" },
      "thumbnail": { "type": "string" },
      "uhd": { "type": ["boolean", "null"] },
      "url": { "type": "string", "format": "uri" },
      "copyrightlink": { "type": "string", "format": "uri" },
      "urlbase": { "type": "string" }
    },
    "additionalProperties": false
  }
}
